Номер дела,Дата,Оспариваемое рекламное объявление,Тег,Регион,Нарушение,Ссылка на закон,Решение по делу,,Ссылки,,Варианты ответа верное,Варианты ответа неверное,Итоговый ответ
"№ 56-08/2018
",06.12.2018,,алкоголь неэтичная,Челябинская обл,"""Пивоварня названа фамилией горного инженера Ивана Редикорцева, первооткрывателя месторождений каменного угля на Южном Урале. В Копейске установлен памятник ему, а окружающая монумент территория носит неофициальное наименование «сквер Редикорцева». Использовать в рекламе фамилию горного инженера, почитаемого жителями города, неэтично"".","""Согласно п.5 ч.2 ст.21 Закона о рекламе реклама алкогольной продукции не должна размещаться с использованием технических средств стабильного территориального размещения (рекламных конструкций), монтируемых и располагаемых на крышах, внешних стенах и иных конструктивных элементах зданий, строений, сооружений или вне их. Согласно п.6 ч.1 ст.21 Закона о рекламе реклама алкогольной продукции не должна использовать образы людей. Согласно ч.6 ст.5 Закона о рекламе в рекламе не допускается использование бранных слов, непристойных и оскорбительных образов, сравнений и выражений. """,Предписание на устранение рекламы,,https://disk.yandex.ru/d/Xnwk6MwlbmUtzg/Запрещенная%20реклама/2018-2019/16.jpg ,,"Верное: Согласно п. 5 ч. 2 ст. 21 Закона ""О рекламе"": реклама алкогольной продукции не должна размещаться с использованием технических средств стабильного территориального размещения (рекламных конструкций), монтируемых и располагаемых на крышах, внешних стенах и иных конструктивных элементах зданий, строений, сооружений или вне их.","Неверное: Реклама алкогольной продукции в каждом случае должна сопровождаться предупреждением о вреде ее чрезмерного потребления, причем такому предупреждению должно быть отведено не менее чем десять процентов рекламной площади (ч. 3 ст. 21 ФЗ ""О рекламе"").","Реклама пивоварни ""Redikortsev"" нарушает закон по нескольким п-м. Согласно п. 5 ч. 2 ст. 21 Закона ""О рекламе"": реклама алкогольной продукции не должна размещаться с использованием технических средств стабильного территориального размещения (рекламных конструкций), монтируемых и располагаемых на крышах, внешних стенах и иных конструктивных элементах зданий, строений, сооружений или вне их. Согласно п. 6 ч. 1 ст. 21: реклама алкогольной продукции не должна использовать образы людей.
В ходе разбирательства реклама признана ненадлежащей, выдано предписание на ее устранение.
Подробнее о деле:
 https://goo.su/Lp0a "
№ 4-14.3-520/00-08-18,14.06.2018,,"алкоголь
нужно пометить, что источник группа во вконтакте!!!",Москва,"Материал является рекламой алкогольной продукции виски под торговой маркой «Jameson», средств индивидуализации виски «Jameson» и мероприятия «Jameson Party». Нарушение состоит размещении рекламы алкогольной продукции в сети Интернет.","П. 8 ч.  2 ст. 21 ФЗ «О
 рекламе»: реклама алкогольной
 продукции
 содержаться в информационно-
 телекоммуникационной
 ""Интернет"".",Штраф 100 тыс.рублей,,https://disk.yandex.ru/d/Xnwk6MwlbmUtzg/Запрещенная%20реклама/До%202016%20включительно/social_image_id.jpg) ,,"Верное: П. 8 ч. 2 ст. 21 ФЗ ""О
 рекламе"": реклама алкогольной
 продукции не должна размещаться в информационно-
 телекоммуникационной сети ""Интернет"".","Неверное: Реклама алкогольной продукции в каждом случае должна сопровождаться предупреждением о вреде ее чрезмерного потребления, причем такому предупреждению должно быть отведено не менее чем десять процентов рекламной площади (ч. 3 ст. 21 ФЗ ""О рекламе"").","Реклама виски ""Jameson"" и мероприятия ""Jameson Party"" размещалась в паблике во ВКонтакте. По п. 8 ч. 2 ст. 21 ФЗ ""О рекламе"": реклама алкогольной продукции не должна содержаться в информационно-телекоммуникационной сети ""Интернет"".
Рекламу признали ненадлежащей, устранили и назначили штраф размером 100 тыс. руб.
Подробнее о деле: https://goo.su/Mq6dFU "
?,?,,алкоголь,Пенза,"Использование запрещенного образа в рекламе. В видеоматериале присутствует образ человека, в результате демонстрации потребитель может сделать вывод, что, по сюжету, действие, отраженное в рекламном ролике, происходит в результате уч. я человека.
(https://vk.com/video-42092668_163044678)","П 6 ч 1 ст 21 ФЗ «О рекламе» : реклама алкогольной продукции не должна использовать образы людей и животных, в том числе выполненные с помощью мультипликации (анимации).
",Предписание на устранение рекламы,,,,"Верное: П. 6 ч. 1 ст. 21 ФЗ ""О рекламе"": реклама алкогольной продукции не должна использовать образы людей и животных, в том числе выполненные с помощью мультипликации (анимации).
","Неверное: Реклама алкогольной продукции не должна содержать утверждение о том, что алкогольная продукция безвредна или полезна для здоровья человека, в том числе информацию о наличии в алкогольной продукции биологически активных добавок, витаминов (п. 3 ч. 1 ст. 21 ФЗ ""О рекламе"").","В видеоматериале все действия происходят в результате участия человека (закадровые диалоги, чокающиеся кружки, автомобили и другие предметы, которые приводятся в движение человеком). По п. 6 ч. 1 ст. 21 ФЗ «О рекламе»: реклама алкогольной продукции не должна использовать образы людей и животных, в том числе выполненные с помощью мультипликации (анимации).
Реклама признана ненадлежащей и устранена.
"
№ А38-3890/2018,13.05.2018,"Магазин разместил рекламу алкоголя в журнале «Красное&Белое»:

Лозунг: «Лето — пора немного охладиться и насладиться вкусом наших лучших новинок! Встречайте самые известные бренды импортного пива. Приходите!»; рядом с лозунгом находились реклама и изображения пива крепостью больше 5% с указанием объема и цен.
",алкоголь,Марий Эл,"Алкоголь крепостью выше 5% можно рекламировать только внутри торговой точки, в том числе в дегустационных залах.

В любой рекламе алкоголя должно быть предупреждение: «Чрезмерное употребление алкоголя вредит вашему здоровью». Где реклама размещается, при этом неважно.

Предупреждению о вреде алкоголя отводится не меньше 10% рекламы.

Указание на возможность утоления жажды.","часть 2.1 ст. 21 ФЗ ""О рекламе"":
Реклама алкогольной продукции с содержанием этилового спирта пять и более процентов объема готовой продукции разрешается только в стационарных торговых объектах, в которых осуществляется розничная продажа алкогольной продукции, в том числе в дегустационных залах таких торговых объектов.

п. 4 ч. 1 ст. 21 ФЗ ""О рекламе"":
Реклама алкогольной продукции не должна содержать упоминание о том, что употребление алкогольной продукции является одним из способов утоления жажды.",Производство прекращено из-за невозможности установления сторон.,,,,"Верное:
Реклама алкоголя не может содержать указание на возможность утоления жажды (п. 4 ч. 1 ст. 21 ФЗ ""О рекламе"").","Неверное: Реклама не может распространяться в предназначенных для несовершеннолетних печатных изданиях, аудио- и видеопродукции (п. 2 ч. 2 ст. 21 ФЗ ""О рекламе"").","Реклама содержит целый ряд нарушений:

- алкоголь крепостью выше 5% можно рекламировать только внутри торговой точки, в том числе в дегустационных залах;
- в любой рекламе алкоголя должно быть предупреждение: «Чрезмерное употребление алкоголя вредит вашему здоровью», причем неважно, где реклама размещена;
- предупреждению о вреде алкоголя отводится не менее 10% рекламы;
- указание на возможность утоления жажды.

Не соответствует следующим п-м законодательства: ч. 2.1 ст. 21, п. 4 ч. 1 ст. 21, ч. 3 ст. 21 ФЗ ""О рекламе"".
Делопроизводство было прекращено из-за невозможности установления сторон.
Подробнее о деле: https://goo.su/uz42
"
№3-16-29/78-01-18,27.08.2018,,алкоголь,Санкт-Петербург,"""Реклама пива Burik Beer без сопровождения обязательной пометкой, предупреждающей о вреде чрезмерного потребления алкоголя. Также изображение расположено на первой полосе газеты"".","На основании п. 1 ч. 2 ст. 21 Закона о рекламе реклама пива и напитков, изготавливаемых на основе пива, не должна размещаться на первой и последней полосах газет, а также на первой и последней страницах и обложках журналов. В силу ч. 3 ст. 21 ФЗ Закона о рекламе реклама алкогольной продукции в каждом случае должна сопровождаться предупреждением о вреде ее чрезмерного потребления, причем такому предупреждению должно быть отведено не менее чем десять процентов рекламной площади.","Главному редактору
 газеты предписано
 устранить
 перечисленные
 нарушения и
 отчитаться об этом в
 Санкт-Петербургское
 УФАС России.",,https://spb.fas.gov.ru/sites/spb.f.isfb.ru/files/images/20182606114331.jpg ,,"Верное: Реклама пива Burik Beer размещена без сопровождения обязательной пометкой, предупреждающей о вреде чрезмерного потребления алкоголя (ч. 3 ст. 21 ФЗ ""О рекламе""). ","Неверное: Реклама алкогольной продукции не может использовать образы людей и животных (п. 6 ч. 1 ст. 21 ФЗ ""О рекламе"").","Реклама пива Burik Beer не сопровождалась обязательной пометкой, предупреждающей о вреде чрезмерного потребления алкоголя и находилась на первой полосе газеты. На основании п. 1 ч. 2 ст. 21: реклама пива и напитков, изготавливаемых на основе пива, не должна размещаться на первой и последней полосах газет, а также на первой и последней страницах и обложках журналов; ч. 3 ст. 21 ФЗ ""О рекламе"": реклама алкогольной продукции в каждом случае должна сопровождаться предупреждением о вреде ее чрезмерного потребления, причем такому предупреждению должно быть отведено не менее чем десять процентов рекламной площади.
Выдано предписание на устранение нарушений.
Подробнее о деле: https://goo.su/vVIT4o

"
-,-,,"алкоголь
заблуждение",Москва,"Искажение смысла
информации и
введение в
заблуждение
потребители рекламы.","Ч. 7 ст. 5 ФЗ «О рекламе»: не допускается
реклама, в которой отсутствует часть
существенной информации о рекламируемом
товаре, об условиях его приобретения или
использования, если при этом искажается
смысл информации и вводятся в заблуждение
потребители рекламы.","Но большинству экспертов ФАС нарушение указанного п. закона ""О рекламе"" обнаружить не удалось: сделанное ""Очаково"" сравнение корректно, поскольку для каждого бренда указаны одинаковые и правдивые характеристики. Не помогли и возражения о том, что все пиво варится на российских заводах. К счастью для конкурентов ""Очаково"", в той же самой ст. 5 закона нашлась еще и часть 7: не допускается реклама, ""если искажается смысл информации и вводятся в заблуждение потребители"". Но и тут при всей явной провокационности рекламы формального нарушения закона нет, возражали другие члены совета. ""Очаково"" просто приводит факты, причем достоверные.",,,,"Верно: Ч. 7 ст. 5 ФЗ ""О рекламе"": не допускается реклама, в которой отсутствует часть существенной информации о рекламируемом товаре, об условиях его приобретения или использования, если при этом искажается смысл информации и вводятся в заблуждение потребители рекламы.","Неверно: П. 8 ч. 2 ст. 21 ФЗ «О рекламе»: реклама алкогольной продукции не должна размещаться в информационно-телекоммуникационной сети ""Интернет"".","Ч. 7 ст. 5 ФЗ «О рекламе»: не допускается реклама, в которой отсутствует часть существенной информации о рекламируемом товаре, об условиях его приобретения или использования, если при этом искажается смысл информации и вводятся в заблуждение потребители рекламы. Также согласно п. 1 ч. 2 ст. 5 ФЗ ""О рекламе"": недобросовестной признается реклама, которая содержит некорректные сравнения рекламируемого товара с находящимися в обороте товарами, которые произведены другими изготовителями или реализуются другими продавцами.
Но эксперты ФАС нарушение указанных пп. закона ""О рекламе"" не обнаружили: сделанное ""Очаково"" сравнение корректно, смысл представленной информации понятен.
Подробнее о деле: https://goo.su/xnU1Mw7"
https://sovetreklama.ru/assets/images/docs/resheniya/7.%20рассмотрение%20запроса%20из%20КПВСМИ%20по%20рекламе%20Pub%20Docker%20с%20использованием%20образов%20животных.pdf ,,,алкоголь несовершеннолетние ,Санкт-Петербург,"Содержание вышеуказанной рекламы, которая, используя изображения животных и алкогольного напитка, оказывает негативное влияние на несовершеннолетних детей.","В данном случае имеет место реклама с изображением кота и надписи ""Котик, где пиво?"", которая содержит признаки нарушения п. 6 ч. 1 ст. 21 ​Федерального закона от 13.03.2006 No38-ФЗ «О рекламе»,​ запрещающей использовать образы животных в рекламе алкогольной продукции","1. Нарушения ​Федерального закона от 13.03.2006 No38-ФЗ «О рекламе» и Кодекса рекламы и маркетинговых коммуникаций Международной торговой палаты (МТП) не выявлены 2. Данные макеты не являются рекламой алкогольной продукции, не содержат оскорбительных или непристойных образов, оказывающих вред несовершеннолетним",,,,"Верно: В рекламе алкогольной продукции запрещено использовать образы людей и животных (п. 6 ч. 1 ст. 21 ФЗ ""О рекламе"").","Неверное: Согласно п. 5 ч. 2 ст. 21 ФЗ ""О рекламе"": реклама алкогольной продукции не должна размещаться с использованием технических средств стабильного территориального размещения, монтируемых и располагаемых на крышах, внешних стенах и иных конструктивных элементах зданий. ","Претензия касалась п. 6 ч. 1 ст. 21 ФЗ ""О рекламе"": запрет на использование образов людей и животных в рекламе алкоголя. Но эксперты рекламного совета считают, что рассматриваемые материалы не содержат объекта рекламирования и не являются рекламными.
Подробнее о деле: https://goo.su/PTsU"
