Номер дела,Дата,Оспариваемое рекламное объявление,Тег,Регион,Нарушение,Ссылка на закон,Решение по делу,,Ссылки,,Варианты ответа верное,Варианты ответа неверное,Итоговый ответ
?,14.08.2013,,алкоголь,Россия,"""Размещение рекламы алкогольной продукции в телепрограмме во время трансляции футбольного матча Россия-Бразилия на федеральном телевизионном канале"".","""п. 3 ч. 2 ст. 21 ФЗ «О рекламе» реклама алкогольной продукции не должна размещаться в теле- и радиопрограммах, при кино- и видеообслуживании"".","Четыре штрафа по 150 тыс. рублей
рублей.",,-,,"Верное: Реклама алкогольной продукции была размещена во время трансляции футбольного матча на федеральном телевизионном канале. Такая реклама не может размещаться в теле- и радиопрограммах, при кино- и видеообслуживании (п. 3 ч. 2 ст. 21 ФЗ ""О рекламе"").","Неверное: Рекламное объявление не может быть размещено в физкультурно-оздоровительных/ спортивных сооружениях и ассоциироваться с тем, что алкогольная продукция способствует спортивному успеху (п. 1 ч. 1 ст. 21 и п. 7 ч. 2 ст. 21 ФЗ ""О рекламе"").","Во время трансляции футбольного матча Россия-Бразилия на федеральном телевизионном канале была размещена реклама алкоголя. Согласно п. 3 ч. 2 ст. 21 ФЗ ""О рекламе"": реклама алкогольной продукции не должна размещаться в теле- и радиопрограммах, при кино- и видеообслуживании.
В ходе разбирательства реклама была признана ненадлежащей и получила четыре штрафа по 150 тыс. руб.
Подробнее о деле: https://goo.su/oJl0zZA
"
https://www.oblgazeta.ru/society/54820/,21.01.2016,,алкоголь ,Свердловским УФАС,"Реклама алкогольной продукции не должна использовать образы людей и животных, в том числе выполненные с помощью мультипликации (анимации)","п.6 ч.1 ст. 21 ФЗ “о рекламе” реклама алкогольной продукции не должна использовать образы людей и животных, в том числе выполненные с помощью мультипликации (анимации)"".",Реклама была признана ненадлещаей. Компания признана виновной и оштрафована.,,https://www.oblgazeta.ru/society/54820/,,"Верное: Согласно п. 6 ч. 1 ст. 21 ФЗ ""О рекламе"": реклама алкогольной продукции не должна использовать образы людей и животных. ","Неверное: Согласно п. 5 ч. 2 ст. 21 ФЗ ""О рекламе"": реклама алкогольной продукции не должна размещаться с использованием технических средств стабильного территориального размещения, монтируемых и располагаемых на крышах, внешних стенах и иных конструктивных элементах зданий. ","Реклама сети алкомаркетов ""Семь пятниц"" признана незаконной. Согласно п. 6 ч. 1 ст. 21 ФЗ ""О рекламе"": реклама алкогольной продукции не должна использовать образы людей и животных, в том числе выполненные с помощью мультипликации (анимации). Штраф для юрлиц за это нарушение составляет от 100 до 500 тысяч рублей.
В ходе разбирательства реклама была признана ненадлещаей, компания признана виновной и оштрафована.
Подробнее о деле: https://goo.su/I9Y4Q "
"№ 873-02-4515-Р/12
",21.09.2012,,алкоголь ,Ленинградская обл,"""Использование образов детей, отсутствие предупреждени я о вреде здоровью"".","""Ч.3 ст. 21 ФЗ “о рекламе” реклама алкогольной продукции в каждом случае должна сопровождаться предупреждением о вреде ее чрезмерного потребления, причем такому предупреждению должно быть отведено не менее чем десять процентов рекламной площади (пространства); п.6 ч.1 ст. 21 ФЗ “о рекламе” реклама алкогольной продукции не должна использовать образы людей и животных, в том числе выполненные с помощью мультипликации (анимации)"".","Штраф 150 тыс. рублей
рублей.",,https://new-retail.ru/upload/iblock/15a/15a6b619f93ec7a58e7cc32bf82260f3.jpg ,,"Верное: П. 6 ч. 1 ст. 21 ФЗ ""О рекламе"": реклама алкогольной продукции не должна использовать образы людей и животных, в том числе выполненные с помощью мультипликации (анимации).","Неверное: Реклама алкогольной продукции не должна обращаться к несовершеннолетним (п. 5 ч. 1 ст. 21 ФЗ ""О рекламе"").","В этой рекламе можно обнаружить сразу несколько нарушений. По ч. 3 ст. 21 ФЗ ""О рекламе"": реклама алкогольной продукции в каждом случае должна сопровождаться предупреждением о вреде ее чрезмерного потребления, причем такому предупреждению должно быть отведено не менее чем десять процентов рекламной площади (пространства); п. 6 ч. 1 ст. 21 ФЗ: реклама алкогольной продукции не должна использовать образы людей и животных, в том числе выполненные с помощью мультипликации (анимации).
ФАС признала рекламу ненадлежащей и выдала предписание на ее устранение.
Подробнее о деле:  https://goo.su/zxUuKVV
"
"№ 08/04/14.3-16/2021
",10.02.2021,,алкоголь неэтичная,Москва,"Рекламу виски торговой марки Dewar's, распространявшуюся на канале  в видеоролике от 16.07.2020 ""Трамп одобрил кибератаку / Как остановить Эппл и Гугл? / Профессора растворили в кислоте"" на сайте youtube.com (https://www.youtube.com/watch?v=vynjwRdqOa8&t) и в видеоролике от 11.08.2020 ""Столкновения и беспорядки в Белоруссии / Е. госпитализировали из суда /Авиакатастрофа в Индии"" (https://www.youtube.com/watch?v=7xlH5JEehYQ). Минуты (5:05; 4:57 соответственно).
","Согласно п.у 8 ч.  2 ст. 21 Федерального закона ""О рекламе"" реклама алкогольной продукции не должна размещаться в информационно-телекоммуникационной сети ""Интернет"".
Следовательно, реклама виски торговой марки Dewar's не должна размещаться в информационно-телекоммуникационной сети Интернет.
Вместе с тем реклама виски торговой марки Dewar's распространяется на сайте youtube.com в сети Интернет.
",Штраф 2 тыс. рублей.,,https://youtu.be/vynjwRdqOa8 ,,"Верное: П. 8 ч. 2 ст. 21 ФЗ ""О рекламе"": реклама алкогольной продукции не должна размещаться в информационно-телекоммуникационной сети ""Интернет"".","Неверное: Реклама алкогольной продукции в каждом случае должна сопровождаться предупреждением о вреде ее чрезмерного потребления, причем такому предупреждению должно быть отведено не менее чем десять процентов рекламной площади (ч. 3 ст. 21 ФЗ ""О рекламе"").","Реклама виски торговой марки Dewar's, распространялась А. Лебедевым в видеоролике от 16.07.2020 ""Трамп одобрил кибератаку..."" и в видеоролике от 11.08.2020 ""Столкновения и беспорядки в Белоруссии..."" на сайте youtube.com. Согласно п. 8 ч. 2 ст. 21 ФЗ ""О рекламе"": реклама алкогольной продукции не должна размещаться в информационно-телекоммуникационной сети ""Интернет"".
Реклама была признана ненадлежащей и оштрафована на 2 тыс. руб.
Подробнее о деле: https://goo.su/4wIz
"
"№ 3-21-15/00-08-19
",21.05.2019,,алкоголь,Москва,"В ФАС России поступило обращение гражданина с жалобой на рекламу виски торговой марки Dewar's, распространявшуюся на канале  в видеоролике от 21.12.2018 ""Нетуристический Каир: мусор, кладбище и свиньи"" на сайте youtube.com (https://www.youtube.com/watch?v=8QNMwdp7loY).
В видеоролике с 5:09 минуты  сидит за столом, на котором стоит виски под торговой маркой Dewar's и стакан с напитком.
","Согласно п.у 8 ч.  2 ст. 21 Федерального закона ""О рекламе"" реклама алкогольной продукции не должна размещаться в информационно-телекоммуникационной сети ""Интернет"".
Следовательно, реклама виски торговой марки Dewar's не должна размещаться в информационно-телекоммуникационной сети Интернет.
Вместе с тем реклама виски торговой марки Dewar's распространяется на сайте youtube.com в сети Интернет.
",Предписание на устранение рекламы.,,https://youtu.be/8QNMwdp7loY ,,"Верное: Согласно п. 8 ч. 2 ст. 21 ФЗ ""О рекламе"": реклама алкогольной продукции не должна размещаться в информационно-телекоммуникационной сети ""Интернет"".","Неверное: Реклама не должна содержать упоминание о том, что употребление алкогольной продукции является одним из способов утоления жажды (п. 4 ч. 1 ст. 21 ФЗ ""О рекламе"").","В ФАС поступила жалоба на рекламу виски Dewar's на канале ""varlamov"" в ролике от 21.12.2018 ""Нетуристический Каир: мусор, кладбище и свиньи"" на сайте youtube.com. Согласно п. 8 ч. 2 ст. 21 ФЗ ""О рекламе"": реклама алкогольной продукции не должна размещаться в информационно-телекоммуникационной сети ""Интернет"".
Рекламу признали ненадлежащей и выдали предписание на ее устранение.
Подробнее о деле: https://goo.su/dspC "
?,05.02.2016,,алкоголь,Россия,"Создание впечатления значимости употребления алкогольной продукции. ""Как видете Staropramen-мания захлестнула не только Прагу, но и весь мир. Присоединяйтесь и заказывайте самую популярную в Праге пену для ванны Staropramen на нашем сайте..."" ","""ч.1 ст. 21 ФЗ “о рекламе” реклама алкогольной продукции не должна содержать утверждение о том, что употребление алкогольной продукции имеет важное значение для достижения общественного признания, профессионального, спортивного или личного успеха либо способствует улучшению физического или эмоционального состояния.""",Предписание на устранение рекламы.,,https://youtu.be/f8e60xL8s_c ,,"Верное: Ч.1 ст. 21 ФЗ ""О рекламе"": реклама алкогольной продукции не должна содержать утверждение о том, что употребление алкогольной продукции имеет важное значение для достижения общественного признания, профессионального, спортивного или личного успеха либо способствует улучшению физического или эмоционального состояния.","Неверное: Ч. 2.1 ст. 21 ФЗ ""О рекламе"": реклама алкогольной продукции с содержанием этилового спирта пять и более процентов объема готовой продукции разрешается только в стационарных торговых объектах, в которых осуществляется розничная продажа алкогольной продукции, в том числе в дегустационных залах таких торговых объектов.","Реклама создает впечатление значимости употребления алкоголя (""как видите Staropramen-мания захлестнула не только Прагу, но и весь мир""). В соответствии с ч. 1 ст. 21 ФЗ ""О рекламе"": реклама алкогольной продукции не должна содержать утверждение о том, что употребление алкогольной продукции имеет важное значение для достижения общественного признания, профессионального, спортивного или личного успеха либо способствует улучшению физического или эмоционального состояния.
Реклама была признана ненадлежащей и устранена.
"
РЦ.08.09.43,20 января 2010,,недобросовестная реклама (+ реклама алкогольной продукции),Москва и МО,"Вместе с тем товарный знак ""Казёнка"", представленный словесным обозначением ""Казёнка"", выполненным белым шрифтом с желтой обводкой, с гербом в виде коронованного крылатого щита с буквой ""К"" в центре, а также с гильоширным узором на заднем плане, индивидуализирует широко представленную в продаже водку ""Казёнка"" и применяется на ее этикетках. Помимо словесного обозначения ""Казёнка"" и герба реклама содержала утверждения ""Скоро!"" и ""фильм"". При данных обстоятельствах представленная реклама не может расцениваться, как явно относящаяся к рекламе фильма, и является рекламой алкогольной продукции - водки ""Казёнка"".","В соответствии с частью 4 ст. 2 закона ""О рекламе"" специальные требования и ограничения, установленные данным законом в отношении рекламы отдельных видов товаров, распространяются также на рекламу средств индивидуализации таких товаров, их изготовителей или продавцов, за исключением случая, если реклама средств индивидуализации отдельного товара, его изготовителя или продавца явно не относится к товару, в отношении рекламы которого данным законом установлены специальные требования и ограничения.
В соответствии с п.ом 3 ч.  2 ст. 5 закона ""О рекламе"" не допускается недобросовестная реклама, которая представляет собой рекламу товара, реклама которого запрещена данным способом, в данное время или в данном месте, если она осуществляется под видом рекламы другого товара, товарный знак или знак обслуживания которого тождествен или сходен до степени смешения с товарным знаком или знаком обслуживания товара, в отношении рекламы которого установлены соответствующие требования и ограничения, а также под видом рекламы изготовителя или продавца такого товара.
Согласно п.у 5 ч.  2 ст. 21 закона ""О рекламе"" реклама алкогольной продукции не должна размещаться с использованием технических средств стабильного территориального размещения (рекламных конструкций), монтируемых и располагаемых на крышах, внешних стенах и иных конструктивных элементах зданий, строений, сооружений или вне их.","Признана ненадлежащей, выданы предписания о прекращении нарушения законодательства о рекламе и наложен штраф в размере 50 000 рублей",,,,"Верное: Согласно п. 5 ч. 2 ст. 21 закона ""О рекламе"": реклама алкогольной продукции не должна размещаться с использованием технических средств стабильного территориального размещения (рекламных конструкций), монтируемых и располагаемых на крышах, внешних стенах и иных конструктивных элементах зданий, строений, сооружений или вне их.","Неверное: Не допускается реклама о проведении стимулирующего мероприятия, условием участия в котором является приобретение алкогольной продукции, за исключением специализированных стимулирующих мероприятий, проводимых в целях реализации алкогольной продукции (ч. 5 ст. 21 ФЗ ""О рекламе""). ","Реклама водки ""Казенка"" размещалась на рекламных конструкциях города Москвы и Подмосковья в апреле-мае 2009 г. Согласно п. 5 ч. 2 ст. 21 ФЗ ""О рекламе"": реклама алкогольной продукции не должна размещаться с использованием технических средств стабильного территориального размещения (рекламных конструкций), монтируемых и располагаемых на крышах, внешних стенах и иных конструктивных элементах зданий, строений, сооружений или вне их.
Реклама признана ненадлежащей, выдано предписание о прекращении нарушения, и наложен штраф в размере 50 000 рублей.
Подробнее о деле: https://goo.su/u9in2xJ"
