Номер дела,Дата,Оспариваемое рекламное объявление,Тег,Регион,Нарушение,Ссылка на закон,Решение по делу,Варианты ответа верное,Варианты ответа неверное,Итоговый ответ
08-05-16/04,18 февраля 2016,,недобрососветная реклама,Мурманск,"Реклама «РАЗВОРАЧИВАЙТЕСЬ! Новый дилер Renault г. Мурманск, ул. Свердлова, д.11, тел.690000» была размещена на баннере в 200 метрах от автосалона конкурента ООО «Рено-Мурманск». Текст рекламы создавал впечатление у потребителя рекламы, что деятельность по продаже и обслуживанию автомобилей Renault по адресу пр. Кольский110Б, в г. Мурманске больше не осуществляется и теперь необходимо обращаться к новому дилеру по указанному в рекламе адресу","Согласно п.у 4 ч.  2 ст. 5 Закона о рекламе недобросовестной признается реклама, которая является актом недобросовестной конкуренции в соответствии с антимонопольным законодательством. В силу ч.  7 ст. 5 Закона о рекламе не допускается реклама, в которой отсутствует часть существенной информации о рекламируемом товаре, об условиях его приобретения или использования, если при этом искажается смысл информации, и вводятся в заблуждение потребители рекламы.","Признана ненадлежащей, выдано предписание о прекращении нарушения законодательства о рекламе и наложен штраф за нарушение законодательства о рекламе в размере 110 000 рублей","Верное: Рекламная фраза ""РАЗВОРАЧИВАЙТЕСЬ! Новый диллер..."" создает впечатление, что автосалоны, расположенные рядом, больше не осуществляют деятельность по продаже и обслуживанию автомобилей, и призывает обращаться к новому диллеру. Это вводит потребителей рекламы в заблуждение, что нарушает ч. 7 ст. 5 и п. 4 ч. 2 ст. 5 ФЗ ""О рекламе"".","Неверное: Яркий рекламный билборд содержит кричащую надпись ""РАЗВОРАЧИВАЙТЕСЬ!"", которая может напугать водителей, угрожая безопасности движения автомобильного транспорта, поэтому реклама нарушает п. 3 ч. 4 ст. 5 ФЗ ""О рекламе"".","Рекламная фраза ""РАЗВОРАЧИВАЙТЕСЬ! Новый диллер..."" создает впечатление, что автосалоны, расположенные рядом, больше не осуществляют деятельность по продаже и обслуживанию автомобилей, и призывает обращаться к новому диллеру, что является актом недобросовестной конкуренции. Отсутствие части  существенной информации также вводит потребителей в заблуждение, поэтому реклама нарушает п. 4 ч. 2 и ч. 7 ст. 5 ФЗ ""О рекламе"". В результате судебного разбирательства был назначен административный штраф в размере 110 000 рублей.
Подробнее о деле: https://goo.su/VZG2 "
63,10 июня 2016,«Плитка. Керамогранит. Сантехника. Мозайка. ТЦ Мой Дом» Данный текст сопровождается изображением персонажа мультфильма «Малыш и Карлсон» - Фрекен Бок. ,недобросовестная реклама,Ставропольский край,"В данном случае образ персонажа мультфильма «Малыш и Карлсон» - Фрекен Бок является интеллектуальной собственностью, которой предоставляется правовая охрана (интеллектуальная собственность). Законом не допускается продажа, обмен или иное введение в оборот товара, если при этом незаконно использовались результаты интеллектуальной деятельности.","В соответствии с п.ом 4 ч.  2 ст. 5 Федерального закона от 13.03.2006 №38-ФЗ «О рекламе», недобросовестной признается реклама, которая является актом недобросовестной конкуренции в соответствии с антимонопольным законодательством.

В соответствии с частью 11 ст. 5 Федерального закона от 13.03.06 №38-ФЗ ""О рекламе"", при производстве, размещении и распространении рекламы должны соблюдаться требования законодательства Российской Федерации, в том числе требования законодательства о государственном языке Российской Федерации, законодательства об авторском праве и смежных правах.","Признана ненадлежащей, выдано предписание о нарушении законодательства о рекламе и наложен штраф в размере 4 000 рублей","Верное: В рекламе незаконно использовался результат интеллектуальной деятельности - персонаж Фрекен Бок, что является актом недобросовестной конкуренции (п. 4 ч. 2 ст. 5 ФЗ ""О рекламе"") и несоблюдения законодательства РФ (ч. 11 ст. 5 ФЗ ""О рекламе"").","Неверное: В рекламе строительных товаров используется образ Фрекен Бок, что воспринимается потребителями рекламы как оскорбление персонажа, который совершенно не связан со строительством. Такая реклама нарушает ч. 6 ст. 5 ФЗ ""О рекламе"". ","Образ персонажа мультфильма «Малыш и Карлсон» - Фрекен Бок является интеллектуальной собственностью, которой предоставляется правовая охрана. Согласно законодательству РФ, не допускается продажа, обмен или иное введение в оборот товара, если при этом незаконно использовались результаты интеллектуальной деятельности. В рекламе незаконно использовался персонаж Фрекен Бок, что является актом недобросовестной конкуренции. Таким образом, реклама нарушает п. 4 ч. 2 и ч. 11 ст. 5 ФЗ ""О рекламе"". За нарушение законодательства на рекламодателя был наложен административный штраф в размере 4 000 рублей. Подробнее о деле: https://goo.su/B5g4V"
08/05/5-26/2021,17 мая,,"недобросовестная реклама (+ неэтичная реклама, употребление алкогольной продукции, несовершеннолетние, отуствует наименование оказывающего банковские услуги лица)",Москва,"1. Использованное в рекламе утверждение «лучший банк страны» в отношении АО «Альфа-Банк», указывает на превосходство данного банка в сравнении с другими банками, поскольку «лучший» подразумевает, что субъект рекламирования является первым из числа других однородных субъектов, обладая более высокими достоинствами и преимуществом перед ними. В рекламе отсутствует информация о критериях сравнения, на основании которых утверждается о превосходстве АО «Альфа-Банк» над другими банками, что искажает смысл рекламы и вводит потребителей в заблуждение.","В соответствии с п.ом 1 ч.  2 ст. 5 Федерального закона «О рекламе» недобросовестной признается реклама, которая содержит некорректные сравнения рекламируемого товара с находящимися в обороте товарами, которые произведены другими изготовителями или реализуются другими продавцами.

","Признана ненадлежащей, выдано предписание о прекращении законодательства о рекламе, наложен административный штраф в размере 100 000 рублей (Моргенштерну выдано предупреждение)","Верное: Использованное в рекламе утверждение «лучший банк страны» в отношении АО «Альфа-Банк», указывает на превосходство данного банка в сравнении с другими, что является нарушением п. 1 ч. 2 ст. 5 ФЗ ""О рекламе"".","Неверное: Нестатичная съемка рекламного ролика мешает его восприятию потребителем и нарушает п. 6 ч. 7 ст. 5 ФЗ ""О рекламе"".","Использованное в рекламе утверждение «лучший банк страны» в отношении АО «Альфа-Банк», указывает на превосходство данного банка в сравнении с другими банками, поскольку «лучший» подразумевает, что субъект рекламирования является первым из числа других однородных субъектов, обладая более высокими достоинствами и преимуществом перед ними.
Подробнее о деле: https://goo.su/oLlaHKX"
67/Р-2015,12 августа 2015,"«Почему Стройбат, а не Доминго», «Сравни в Доминго и приходи в Интерпол».",недобросовестная реклама (+ недостоверная реклама),Кемеровская область,"В рекламе содержится некорректное сравнение рекламируемого товара и услуг магазина ""Доминго"" с магазинами ""Стройбат"" и ""Интерпол"", что подразумевает предоставление услуг и товаров магазином ""Доминго"" более низкого качества. В тексте вышеуказанной рекламы содержатся не соответствующие действительности сведения о преимуществах рекламируемого товара перед находящимися в обороте товарами других продавцов
","п.ом 1 ч.  2 ст. 5 ФЗ ""О рекламе"" установлено, что недобросовестной признается реклама, которая содержит некорректные сравнения рекламируемого товара с находящимися в обороте товарами, которые произведены другими изготовителями или реализуются другими продавцами.
п.ом 1 ч.  3 ст. 5 ФЗ ""О рекламе"" установлено, что недостоверной признается реклама, которая содержит не соответствующие действительности сведения о преимуществах рекламируемого товара перед находящимися в обороте товарами, которые произведены другими изготовителями или реализуются другими продавцами.
","Признана ненадлежащей, наложен административный штраф в размере 2 000 рублей","Верное: В рекламе используется некорректное сравнение услуг рекламируемых магазинов ""Стройбат"" и ""Интерпол"" с конкурентом - ""Доминго"", что является нарушением п. 1 ч. 2 и п. 1 ч. 3 ст. 5 ФЗ ""О рекламе"".","Неверное: Реклама формирует негативное отношение к лицам, не пользующимся услугами ""Стройбата"" и ""Интерпола"", поскольку косвенно указывается на то, что клиенты ""Доминго"" получают товары более низкого качества из-за превосходства рекламируемых магазинов, что является нарушением п. 4 ч. 4 ст. 5 ФЗ ""О рекламе"".","В рекламе содержится некорректное сравнение рекламируемого товара и услуг магазина ""Доминго"" с магазинами ""Стройбат"" и ""Интерпол"", что подразумевает предоставление услуг и товаров магазином ""Доминго"" более низкого качества. Реклама содержит не соответствующие действительности сведения о преимуществах рекламируемого товара перед другими, поэтому она нарушает п. 1 ч. 2 и п. 1 ч. 3 ст. 5 ФЗ ""О рекламе"". На рекламодателя был наложен штраф в размере 2 000 рублей. Подробнее о деле: https://goo.su/vnPU9c"
08/05/5-49/2019,27 июня 2019,,недобрососветная реклама,,"Утверждение «Бренд №1» указывает на превосходство продукции этого производителя в сравнении с другими товарами. Однако важная информация о критериях такого сравнения является некорректной и вводящей в заблуждение потребителей, поскольку была выполнена мелким, нечитаемым шрифтом, занимала лишь 6% площади кадра и демонстрировалась всего в течение 2 секунд. Соответственно, потребители не получают информацию о критериях сравнения, на основании которых утверждается о превосходстве продукции «Коркунов» над продукцией других производителей, что искажает смысл рекламы и вводит потребителей в заблуждение.","В соответствии с п.ом 1 ч.  2 ст. 5 Федерального закона «О рекламе» недобросовестной признается реклама, которая содержит некорректные сравнения рекламируемого товара с находящимися в обороте товарами, которые произведены другими изготовителями или реализуются другими продавцами.","Признана ненадлежащей, выдано предписание о прекращении нарушения законодательства о рекламе и наложен административный штраф в размере 100 000 рублей ","Верное: Фраза ""Бренд №1"" указывает на превосходство продукции. Однако информация о критериях сравнения рекламируемого товара с другими написана мелким шрифтом, что искажает смысл рекламы и вводит потребителей в заблуждение, нарушая п. 1 ч. 2 ст. 5 ФЗ ""О рекламе"".","Неверное: Реклама содержит не соответствующую действительности информацию о превосходстве над конкурентами (""Бренд №1""), что нарушает п. 1 ч. 3 ст. 5 ФЗ ""О рекламе"".","В рекламе содержится утверждение «Бренд №1», которое указывает на превосходство продукции этого производителя в сравнении с другими товарами. Однако важная информация о критериях такого сравнения выполнена мелким, нечитаемым шрифтом, поэтому потребители не получают ее. Это является нарушением п. 1 ч. 2 ст. 5 ФЗ ""О рекламе"". В результате судебного разбирательства был наложен штраф в размере 100 000 рублей.
Подробнее о деле: https://goo.su/UVSc"
3-00-45/00-08-14,15 октября 2014,,недобросовестная реклама ,"Екатеринбург, Тюмень","В рекламе содержится некорректное сравнение молока ООО «Талицкий молочный завод» с молоком иных производителей по критерию натуральности путем утверждения: «Натуральное долго не хранится» и указания на срок его хранения 5 суток. Из рекламы следует, что молоко ООО «Талицкий молочный завод» со сроком годности 5 суток сравнивается по критерию натуральности с молоком, срок хранения которого более 5 суток. Однако из норм ФЗ от 12.06.2008 N 88-ФЗ «Технический регламент на молоко и молочную продукцию» и Санитарно-эпидемиологических правил и нормативов 2.3.2.1293-03 «Гигиенические требования по применению пищевых добавок» следует, что все молоко, независимо от способа термической обработки и срока годности, является натуральным и в его производстве не используются консерванты и сухое молоко.","Согласно п.у 1 ч.  2 ст. 5 недобросовестной признаётся реклама, которая содержит некорректные сравнения рекламируемого товара с находящимися в обороте товарами, которые произведены другими изготовителями или реализуются другими продавцами.","Признана ненадлежащей, выдано предписание о прекращении нарушения законодательства о рекламе и наложен административный штраф в размере 300 000 рублей ","Верное: Рекламируемое молоко со сроком годности 5 суток сравнивается по критерию натуральности с молоком, срок хранения которого более 5 суток. Однако натуральность молока не зависит от срока годности. Таким образом, реклама нарушает п. 1 ч. 2 ст. 5 ФЗ ""О рекламе"".","Неверное: На рекламном билборде не указана часть существенной информации о рекламируемом товаре, что приводит к искажению информации и нарушает ч. 7 ст. 5 ФЗ ""О рекламе"".","В материале содержится некорректное сравнение молока рекламируемой фирмы с молоком иных производителей по критерию натуральности путем утверждения: «Натуральное долго не хранится» и указания на срок годности 5 суток. Однако молоко, независимо от срока годности, является натуральным. Некорректное сравнение рекламируемого товара с другими запрещается п. 1 ч. 2 ст. 5 ФЗ ""О рекламе"". На рекламодателя был наложен штраф в размере 300 000 рублей.
Подробнее о деле: https://goo.su/qxe6
"
