Номер дела,Дата,Оспариваемое рекламное объявление,Тег,Регион,Нарушение,Ссылка на закон,Решение по делу,Варианты ответа верное,Варианты ответа неверное,Итоговый ответ
N РЦ.08.09.54,20.01.,,недостоверная реклама,Москва,"Из рекламы следует, что чистящие средства ""Domestos"" рекомендованы НИИ Гигиены и охраны здоровья детей и подростков РАМН для уничтожения микробов, включая вирус свиного гриппа. Кроме того, реклама создает впечатление, что использование чистящих средства ""Domestos"" обеспечивает профилактику заболеваний у детей раннего возраста.","В соответствии с п.ом 2 частью 3 ст. 5 Федерального закона ""О рекламе"" недостоверной признается реклама, которая содержит не соответствующие действительности сведения: о любых характеристиках товара, в том числе о его природе, составе, способе и дате изготовления, назначении, потребительских свойствах, об условиях применения товара, о месте его происхождения, наличии сертификата соответствия или декларации о соответствии, знаков соответствия и знаков обращения на рынке, сроках службы, сроках годности товара.

В соответствии с п.ом 10 ч.  3 ст. 5 Федерального закона ""О рекламе"" недостоверной признается реклама, которая содержит не соответствующие действительности сведения о рекомендациях физических или юридических лиц относительно объекта рекламирования либо о его одобрении физическими или юридическими лицами.","Признать рекламу ненадлежащей и выдать ООО ""Ю"" предписание о прекращении нарушения пп. 2, 10 ч.  3 ст. 5 Федерального закона ""О рекламе"".
","Верное: Реклама создает впечатление, что использование чистящих средств ""Domestos"" обеспечивает профилактику заболеваний у детей раннего возраста. Кроме того, из рекламы следует, что чистящие средства ""Domestos"" рекомендованы НИИ Гигиены и охраны здоровья детей и подростков РАМН для уничтожения микробов, включая вирус свиного гриппа.","Неверное: Фраза ""Убивает микробы наповал, включая вирус свиного гриппа"" над фотографией ребёнка несёт оскорбительный смысл, так как потребители могут подумать, что рёбенок в данном случае сравнивается с вирусом свиного гриппа.","Реклама признается недостоверной, так как содержит не соответствующие действительности сведения: о любых характеристиках товара, в том числе о его природе, составе, способе и дате изготовления, назначении, потребительских свойствах, об условиях применения товара, о месте его происхождения. Нарушает п. 2 ч. 3 ст. 5 ФЗ ""О рекламе"".
Подробнее о деле: https://goo.su/xggrOEl"
"N 43-АР-2018
",10.01.2019,,недостоверная реклама,Республика Чувашия,"В рекламе аптеки ""Озерки"" ООО ""Э"" утверждается ""Аптечная СЕТЬ N 1"", т.е. сообщается о преимуществах рекламируемого продавца перед другими продавцами фармацевтических и иных товаров (конкурентов).
","В связи с этим использование в рекламе сравнительной характеристики объекта рекламирования с иными товарами, например путем употребления слов ""лучший"", ""первый"", ""номер один"", должно производиться с указанием конкретного критерия, по которому осуществляется сравнение и который имеет объективное подтверждение.
Реклама, не сопровождаемая таким подтверждением, должна считаться недостоверной как содержащая не соответствующие действительности сведения о преимуществах рекламируемого товара перед находящимися в обороте товарами, изготовленными другими производителями или реализуемыми другими продавцами (п. 1 ч.  3 ст. 5 Закона о рекламе).
","Признать ООО ""Э""  виновным в совершении административного правонарушения, предусмотренного частью 1 ст. 14.3 Кодекса Российской Федерации об административных правонарушениях и назначить ООО ""Э"" наказание в виде административного штрафа в размере 100 000 рублей.
","Верное: В рекламе используется сравнительная характеристика объекта рекламирования с иными товарами, путем использования фразы ""Аптечная СЕТЬ № 1"".","Неверное: Реклама размещена прямо под окнами жилого дома, что может мешать жителям. Из-за своих больших размеров она также затрудняет проход в саму Аптеку ""Озёрки"".","Реклама содержит не соответствующие действительности сведения о преимуществах рекламируемого товара перед находящимися в обороте товарами, изготовленными другими производителями или реализуемыми другими продавцами. Это является нарушением п. 1 ч. 3 ст. 5 ФЗ ""О рекламе"".
Подробнее о деле: https://goo.su/eqxfnr"
N А40-64553/11-26-476,4 июля 2012,https://youtu.be/pBb-WMLjXso,недостоверная реклама,Москва,"Компания Nestle заявила, что реклама бульона Knorr, который производит Unilever, дискредитирует ее продукцию под брендом Maggi. Компания объяснила это фонетической близостью слов Maggi (""Магги"") и ""магия"", и назвала слоган Unilever актом недобросовестной конкуренции. Юрист Nestle заявил, что с тем же успехом компания могла бы использовать слоган ""Никакого волшебства!"" - тогда бы к ней не возникло вопросов по поводу обыгрывания товарной марки Maggi. Nestle потребовала признать рекламу Knorr ненадлежащей и заставить ответчика прекратить ее распространение.","При проверке принятых по делу решения и постановления Федеральный арбитражный суд Московского округа не установил наличие оснований для их отмены, предусмотренных ст. 288 АПК РФ.","Арбитражный суд Москвы отказал компании Nestle в удовлетворении иска к компании Unilever, поданного из-за рекламы бульона Knorr со слоганом ""Никакой магии!"".","Верное: Бренд Maggi заявил о том, что фраза в рекламе ""Никакой магии"" является актом недобросовестной конкуренции со стороны производителя Unilever, так как есть фонетическая близость слов Maggi (""Магги"") и ""магия"".","Неверное: Фраза в рекламном видеоролике ""Думаю, это лучшее изобретение в истории кулинарии"" указывает на преимущество рекламируемого товара перед другими товарами рынка.","Компания Nestle заявила, что реклама бульона Knorr, который производит Unilever, дискредитирует ее продукцию под брендом Maggi. Компания объяснила это фонетической близостью слов Maggi (""Магги"") и ""магия"" и назвала слоган Unilever актом недобросовестной конкуренции. Юрист Nestle заявил, что с тем же успехом компания могла бы использовать слоган: ""Никакого волшебства!"" - тогда бы к ней не возникло вопросов по поводу обыгрывания товарной марки Maggi. Nestle потребовала признать рекламу Knorr ненадлежащей и заставить ответчика прекратить ее распространение.
Подробнее о деле: https://goo.su/tzz2s
"
№3-5-6/00-08-18,13.09.2018,,недостоверная реклама,Москва,"Данная реклама представляет собой два видео ролика, в одном из которых есть слова: ""Практически каждый второй россиянин был заражён половой инфекцией"". Это высказывание не подтверждается статистическими данными Минздрава, более того, суд признал, что оно им противоречит.","Согласно п.у 11 ч.  3 ст. 5 Федерального закона «О рекламе» недостоверной признается реклама, которая содержит не соответствующие действительности сведения о результатах исследований и испытаний.

Из смысла рекламы презервативов «Durex» вытекает, что примерно 50% населения России было заражено заболеванием, передающимся половым путем, что противоречит официальной статистике Минздрава России.","Признать ненадлежащей, нарушающей п. 11 часть 3 ст. 5 Федерального закона «О рекламе», рекламу презервативов «Durex», распространявшуюся на федеральных телевизионных каналах в 2017-18 гг., поскольку в рекламе содержатся не соответствующие действительности сведения о результатах исследований и испытаний. Рекламодателю недостоверной рекламы предписано прекратить нарушения закона. К возбуждению готовится административное дело для назначения штрафа.","Верное: В данном случае реклама указывает на статистические данные о заболеваниях без какой-либо отсылки на достоверный источник. Таким образом, реклама является недостоверной и нарушает п. 1 ч. 3 ст. 5 ФЗ ""О рекламе"".","Неверное: В данном случае не допускается реклама продукции 18+ на платформах видеохостингов, что является нарушением п. 3 ч. 2 ст. 21 ФЗ ""О рекламе"".","Реклама признана ненадлежащей, нарушающей п. 11 ч. 3 ст. 5 ФЗ «О рекламе», поскольку в рекламе содержатся не соответствующие действительности сведения о результатах исследований и испытаний.
Подробнее о деле: https://goo.su/K9MW"
"№ 4-14.3-165/00-08-15
",06.04.2015,https://youtu.be/g1hQoLfhifw,недостоверная и алкоголь,россия,"Приведенные в рекламных видеороликах утверждения указывают на превосходство лекарственного препарата ""Бронхикум"" в сравнении с другими препаратами от кашля по показателям эффективности и скорости действия, и дают основания потребителям полагать, что такое преимущество подтверждено клиническими исследованиями.
(https://www.youtube.com/watch?v=g1hQoLfhifw)","В соответствии с п.ом 1 ч.  3 ст. 5 Федерального закона ""О рекламе"" недостоверной признается реклама, которая содержит не соответствующие действительности сведения о преимуществах рекламируемого товара перед находящимися в обороте товарами, которые произведены другими изготовителями или реализуется другими продавцами.
Согласно п.у 8 ч.  1 ст. 24 Федерального закона ""О рекламе"" реклама лекарственных средств не должна гарантировать положительное действие объекта рекламирования, его безопасность, эффективность и отсутствие побочных действий.",Назначен штраф в размере 100 тыс. руб.,"Верное: Лекарственный препарат ""Бронхикум"" в рекламе позиционируется как средство, благодаря которому можно быстрее и эффективнее вылечиться от кашля. Это указывает на преимущество рекламируемого товара перед находящимися в обороте изделиями.","Неверное: В рекламном ролике текст, в котором содержится дополнительная информация о лекарственном препарате, нечитаема. К тому же, он загораживает картинку, а это сильно мешает восприятию видеоролика.","В соответствии с п. 1 ч. 3 ст. 5 Федерального закона ""О рекламе"" недостоверной признается реклама, которая содержит не соответствующие действительности сведения о преимуществах рекламируемого товара перед находящимися в обороте товарами, которые произведены другими изготовителями или реализуется другими продавцами.
Подробнее о деле: https://goo.su/xRP6aZn
"
Запрос № 110-01.11.2022,01.11.2022,,добросовестная ,Приморский край,"В рекламе используется слово ""идеальные"", что подразумевает превосходство, выделение данного товара из ряда однородных, для подтверждения которого не приводятся конкретные критерии сравнения. Однако СРО не выявило нарушений п. 1 ч.  3 ст. 5 ФЗ ""О рекламе"", поскольку ""идеальный"" трактуется как возвышенный, соответствующий идеалу, то он не является синонимом слову ""лучший"".","Согласно п.у 1 ч.  3 ст. 5 ФЗ ""О рекламе"" признается реклама, которая содержит не соответствующие действительности сведения о преимуществах рекламируемого товара перед находящимися в обороте товарами, которые произведены другими изготовителями или реализуются другими продавцами.","Не выявлено нарушений п. 1 ч.  3 ст. 5 ФЗ ""О рекламе"".","Верный: В рекламе используется фраза ""идеальные ручки"", что указывает на превосходство товара перед другими и не подтверждается конкретными критериями сравнения, что нарушает п. 1 ч. 3 ст. 5 ФЗ ""О рекламе"".","Неверный: Согласно рекламе, товар ""не мажет и не оставляет пятен"", что является намеком на то, что такими качествами не обладают товары конкурентов, это порочит честь, достоинство и деловую репутацию других производителей и нарушает п. 3 ч. 2 ст. 5 ФЗ ""О рекламе"".","В рекламе используется слово ""идеальные"", что подразумевает превосходство, выделение данного товара из ряда однородных, для подтверждения которого не приводятся конкретные критерии сравнения. Однако СРО не выявило нарушений п. 1 ч. 3 ст. 5 ФЗ ""О рекламе"", поскольку ""идеальный"" трактуется как возвышенный, соответствующий идеалу и не является синонимом слову ""лучший"".
Подробнее о деле: https://goo.su/mOc0"
ЗАПРОС № 09-2021,26 февраля 2021,"Рекламный видеоролик, распространяемый 26.12.2020 на телеканале ""Пятница"" с новогодней рекламой аптеки ""Вита"", содержащей текст следующего содержания: ""АПТЕКА ВИТА ГЛАВНАЯ РАСПРОДАЖА с 15 декабря 2020 по 15 января 2021"" и изображением стилизованной елки с шарами, на которых изображены цифры скидок.",Добросовестная ,Свердловская область,"В спорной рекламе не содержится упоминания товаров в смысле Закона о рекламе: ни распродажа, ни сама аптека не являются продуктами, предназначенными для продажи. Товары же, предлагаемые к распродаже, в рекламе не идентифицированы, следовательно, не могут быть объектами рекламирования. Таким образом, характеристика «главная» независимо от собственного смысла и истинности в данном случае не подпадает под действие установленных в Федеральном законе от 13.03.2006 No 38-ФЗ «О рекламе» ограничений. Выражение «главная распродажа» может относиться к самой аптеке - для них эта распродажа является наиболее масштабной и предполагает наибольшие скидки, что не редкость для новогоднего периода.",П. 1 ч. 2 и п. 1 ч. 3 ст. 5 Федерального закона от 13.03.2006 No 38-ФЗ «О рекламе» устанавливаются соответственно запрет на некорректное сравнение товаров и распространение недостоверных сведений о товарах.,"1. Нарушения положений Федерального закона от 13.03.2006 No38-ФЗ «О рекламе» не выявлены. 2. Нарушения норм, изложенных в Российском Кодексе практики рекламы и маркетинговых коммуникаций (2012г.) и в Кодексе рекламы и маркетинговых коммуникаций МТП, не выявлены.","Верный: В рекламе используется фраза ""ГЛАВНАЯ РАСПРОДАЖА"", что может потенциально указывать на превосходство этой распродажи над распродажами других аптек. Это является нарушением п. 1 ч. 3 ст. 5 ФЗ ""О рекламе"".","Неверный: Согласно рекламному видеоролику, речь идет о распродаже в сети аптек ""Вита"", однако не указаны условия распродажи и специальные акции, что вводит в заблуждение покупателей и нарушает п. 3 ч. 2 ст. 5 ФЗ ""О рекламе"".","В рекламе не содержится упоминания товаров в смысле Закона о рекламе: ни распродажа, ни сама аптека не являются продуктами, предназначенными для продажи. Товары же, предлагаемые к распродаже, в рекламе не идентифицированы, следовательно, не могут быть объектами рекламирования. Таким образом, характеристика «Главная», независимо от собственного смысла и истинности, в данном случае не попадает под нарушение п.1 ч. 2, а также ч. 3 ст. 5 ФЗ «О рекламе». Выражение «Главная распродажа» может относиться к самой аптеке - для них эта распродажа является наиболее масштабной и предполагает наибольшие скидки, что не редкость для новогоднего периода.
Подробнее о деле: https://goo.su/s6UD
"
